,어휘,품사,뜻풀이,관련 어휘
28671,엉클어-지다,동사,실이나 줄 따위가 풀기 힘들 정도로 서로 한데 얽히게 되다.,"비슷한말 엉키다
참고 어휘 헝클어-지다"
28675,엉클어-트리다,동사,실이나 줄 따위를 풀기 힘들 정도로 서로 한데 뒤얽히게 하다.,비슷한말 엉클어-뜨리다
28690,엉키다,동사,실이나 줄 따위가 풀기 힘들 정도로 서로 한데 얽히게 되다.,비슷한말 엉클어-지다
28718,엉-하다,동사,개 따위가 물려고 덤비는 소리가 나다.,
28740,엎-누르다,동사,위에서 억지로 내리눌러 일어나지 못하게 하다.,비슷한말 엎어-누르다
28744,엎다,동사,물건 따위를 거꾸로 돌려 위가 밑을 향하게 하다.,
28759,엎드러-뜨리다,동사,남을 앞으로 넘어지게 하다.,비슷한말 엎드러-트리다
28760,엎드러-지다,동사,잘못하여 앞으로 넘어지다.,준말 엎더-지다
28766,엎드러-트리다,동사,남을 앞으로 넘어지게 하다.,비슷한말 엎드러-뜨리다
28779,엎드려-뻗치다,동사,두 손바닥과 발끝으로 몸을 받치고 곧게 뻗쳐 엎드리다.,
28793,엎드리다,동사,배를 바닥에 붙이거나 팔다리를 짚고 몸 전체를 길게 뻗다.,준말 엎디다
28804,엎어-누르다,동사,위에서 억지로 내리눌러 일어나지 못하게 하다.,비슷한말 엎-누르다
28807,엎어-뜨리다,동사,서 있는 물체를 엎어지게 하다.,비슷한말 엎어-트리다
28810,엎어-말다,동사,국수나 떡국 따위를 한 그릇에 곱빼기로 말다.,
28813,엎어-먹다,동사,망하게 하거나 후리어 가지다.,
28816,엎어-삶다,동사,그럴듯한 말로 남을 속이어 자기의 뜻대로 되게 하다.,
28821,엎어-쥐다,동사,손바닥이 밑으로 가게 움켜쥐다.,
28822,엎어-지다,동사,서 있는 사람이나 물체 따위가 앞으로 넘어지다.,참고 어휘 자빠-지다
28837,엎어-트리다,동사,서 있는 물체를 엎어지게 하다.,비슷한말 엎어-뜨리다
28854,엎-지르다,동사,그릇에 담기어 있는 액체 따위를 뒤집어엎어 쏟아지게 하거나 흔들어 넘쳐 나가게 하다.,
28858,엎질러-지다,동사,담긴 그릇에서 액체 따위가 쏟아져 나오게 되다.,
28862,엎쳐-뵈다,동사,구차하게 남에게 머리를 숙이다.,
28868,엎-치다,동사,배를 바닥 쪽으로 깔다.,
28874,엎치락덮치락-하다,동사,자꾸 엎치었다 덮치었다 하다.,
28877,엎치락뒤치락-하다,동사,연방 엎치었다가 뒤치었다가 하다.,비슷한말 뒤치락엎치락-하다
28879,엎치락잦히락-하다,동사,자꾸 엎치었다 잦히었다 하다.,
28974,에구데구-하다,동사,소리를 마구 지르며 크게 울다.,
28977,에-구부러지다,동사,조금 휘우듬하게 구부러지다.,
29055,에끼다,동사,서로 주고받을 물건이나 일 따위를 비겨 없애다.,참고 어휘 맞비겨-떨어지다
29362,에누리-하다,동사,값을 깎다.,
29382,에다,동사,칼 따위로 도려내듯 베다.,
29422,에-돌다,동사,곧바로 선뜻 나아가지 아니하고 멀리 피하여 돌다.,비슷한말 우회-하다(迂廻하다/迂回하다)
29428,에돌아-가다,동사,곧바로 가지 않고 피해서 멀리 돌아가다.,
29456,에-두르다,동사,에워서 둘러막다.,
29459,에둘러-대다,동사,바로 말하지 않고 짐작하여 알아듣도록 둘러대다.,"비슷한말 에-두르다, 에둘러-치다"
29460,에둘러-치다,동사,바로 말하지 않고 짐작하여 알아듣도록 둘러대다.,"비슷한말 에-두르다, 에둘러-대다"
31439,에우다,동사,사방을 빙 둘러싸다.,
31465,에우-치다,동사,둘러서 가리거나 막다.,
31489,에움-하다,동사,무엇을 갚거나 배상하다.,
31491,에워-가다,동사,바른길로 가지 아니하고 둘러 가다.,
31494,에워-싸다,동사,둘레를 빙 둘러싸다.,
33069,에테-하다,동사,주색잡기에 빠지다.,
34268,엔굽이-치다,동사,물이 굽이진 데서 휘돌아 흐르다.,
36694,여겨-듣다,동사,정신을 기울여 새겨듣다.,
36695,여겨-보다,동사,눈에 익혀 가며 기억할 수 있도록 자세히 보다.,
36923,여기다,동사,마음속으로 그러하다고 인정하거나 생각하다.,
37049,여-닫다,동사,문 따위를 열고 닫고 하다.,
37061,여닫-치다,동사,힘을 들여서 세게 열거나 닫다.,
37197,여든-대다,동사,귀찮게 자꾸 억지를 부리다.,
37631,여릉귀-잡히다,동사,능(陵)을 헤치다가 잡히다.,
37666,여립-켜다,동사,여리꾼이 손님을 끌어들이다.,
37760,여물다,동사,과실이나 곡식 따위가 알이 들어 딴딴하게 잘 익다.,"비슷한말 영글다
참고 어휘 야물다"
37800,여미다,동사,벌어진 옷깃이나 장막 따위를 바로 합쳐 단정하게 하다.,
38583,여싯여싯-하다,동사,무슨 말을 하려고 자꾸 머뭇거리다.,
38812,여울-지다,동사,생각 따위가 천천히 타오르는 불길처럼 일어나다.,
38819,여울-치다,동사,여울을 이루어 물결치다.,
38843,여위다,동사,몸의 살이 빠져 파리하게 되다.,참고 어휘 야위다
38949,여의다,동사,부모나 사랑하는 사람이 죽어서 이별하다.,
39426,여진여퇴-하다,동사,일정한 주견 없이 남의 의견에 따라 움직이다. 함께 나아가고 함께 물러난다는 뜻에서 나온 말이다.,"비슷한말 뇌동-하다(雷同하다), 뇌동부화-하다(雷同附和하다), 부화뇌동-하다(附和雷同하다), 부화수행-하다(附和隨行하다), 수중축대-하다(隨衆逐隊하다)"
39442,여짓-거리다,동사,무슨 말을 할 듯 할 듯 자꾸 머뭇거리다.,"비슷한말 여짓-대다, 여짓여짓-하다"
39443,여짓-대다,동사,무슨 말을 할 듯 할 듯 자꾸 머뭇대다.,비슷한말 여짓-거리다
39445,여짓여짓-하다,동사,무슨 말을 할 듯 할 듯 계속 머뭇거리다.,비슷한말 여짓-거리다
39449,여쭈다,동사,웃어른에게 말씀을 올리다.,"비슷한말 사뢰다, 여쭙다"
39452,여쭙다,동사,웃어른에게 말씀을 올리다.,"비슷한말 사뢰다, 여쭈다"
39600,여탐굿-하다,동사,집안에 경사가 있을 때 먼저 조상에게 아뢰는 굿을 하다.,
39601,여탐-하다,동사,무슨 일이 있을 때 웃어른의 뜻을 알기 위하여 미리 여쭈다.,
39621,여투다,동사,돈이나 물건을 아껴 쓰고 나머지를 모아 두다.,
39941,여흘여흘-하다,동사,강이나 개울의 물살이 빠르게 좔좔 흐르다.,
41022,역성-들다,동사,누가 옳고 그른지는 상관하지 아니하고 무조건 한쪽 편만 들다.,비슷한말 역성-하다
41028,역성-하다,동사,누가 옳고 그른지는 상관하지 아니하고 무조건 한쪽 편만 들다.,비슷한말 역성-들다
42217,엮다,동사,노끈이나 새끼 따위의 여러 가닥을 얽거나 이리저리 어긋매어 어떤 물건을 만들다.,
43929,연-들다,동사,감이 익어 말랑말랑하게 되다.,
44991,연사질-하다,동사,(낮잡는 뜻으로) 자신의 의도를 알아채지 못할 정도의 약삭빠른 말로 남을 꾀어 그의 속마음을 떠보다.,
48660,열고-나다,동사,몹시 급하게 서두르다.,
48856,열다,동사,열매가 맺히다.,비슷한말 열-리다
49061,열-뜨다,동사,마음이 안정되지 못하여 주변 일에 우왕좌왕하다.,
49062,열-뜨리다,동사,‘열다’를 강조하여 이르는 말.,
49107,열렁-거리다,동사,크고 긴 물건 따위가 이리저리 자꾸 흔들리다.,"비슷한말 열렁-대다, 열렁열렁-하다
참고 어휘 얄랑-거리다, 일렁-거리다"
49108,열렁-대다,동사,크고 긴 물건 따위가 이리저리 자꾸 흔들리다.,비슷한말 열렁-거리다
49110,열렁열렁-하다,동사,크고 긴 물건 따위가 이리저리로 자꾸 흔들리다.,비슷한말 열렁-거리다
49111,열렁-이다,동사,크고 긴 물건 따위가 이리저리 흔들리다.,
49148,열-리다,동사,열매가 맺히다.,비슷한말 열다
49271,열매솎기-하다,동사,나무를 보호하고 좋은 과실을 얻기 위하여 너무 많이 달린 과실을 솎아 내다.,비슷한말 적과-하다(摘果하다)
49864,열어-붙이다,동사,문이나 창문 따위를 갑자기 힘차게 열다.,
49869,열어-젖뜨리다,동사,문이나 창문 따위를 갑자기 활짝 열다.,비슷한말 열어-젖트리다
49870,열어-젖트리다,동사,문이나 창문 따위를 갑자기 활짝 열다.,비슷한말 열어-젖뜨리다
49871,열어-젖히다,동사,문이나 창문 따위를 갑자기 벌컥 열다.,
,어휘,품사,뜻풀이,관련 어휘
400,세그루짓기-하다,동사,같은 땅에서 1년에 종류가 다른 농작물을 세 번 심어 거두다.,"비슷한말 삼모-하다(三毛하다), 삼모작-하다(三毛作하다)"
598,세-나다,동사,상처나 부스럼 따위가 덧나다.,
686,세다,동사,머리카락이나 수염 따위의 털이 희어지다.,
1063,세로뜨기-하다,동사,"뜨개질 따위에서, 올의 방향을 위에서 아래로 뜨다.",
1102,세로쓰기-하다,동사,글씨를 위에서 아래로 써 내려가다.,"비슷한말 내리쓰기-하다, 종서-하다(縱書하다)
반대말 가로쓰기-하다, 횡서-하다(橫書하다)"
1103,세로-쓰다,동사,글자를 위에서 아래로 이어서 쓰다.,반대말 가로-쓰다
1353,세마치-하다,동사,대장간에서 쇠를 불릴 때에 세 사람이 돌려 가며 큰 마치를 치다.,
1821,세벌갈이-하다,동사,논이나 밭을 세 번째로 갈다.,
1828,세벌매기-하다,동사,벼를 심은 논에 마지막으로 김매기를 하다.,"비슷한말 만도리-하다, 만물-하다"
2493,세어-지다,동사,세게 되다.,준말 세-지다
2566,세우다,동사,주장이나 고집 따위를 강하게 내세우다.,
2599,세워깔기-하다,동사,"돌, 벽돌 따위의 네모진 재료를 길이로 세워서 깔다.",
2605,세워쌓기-하다,동사,벽돌을 길이로 세워 쌓다.,
2963,세장질-하다,동사,"어린아이를 운동시키기 위하여, 일으켜 앉히어서 두 손을 붙들고 ‘달강달강’ 소리를 내면서, 앞뒤로 자꾸 밀었다 당겼다 하다.",
3071,세제곱-하다,동사,같은 수를 세 번 곱하다.,
5022,셈-나다,동사,사물을 분별하는 판단력이 나다.,
5031,셈-들다,동사,사물을 분별하는 판단력이 생기다.,
5091,셈-하다,동사,수를 세다.,비슷한말 계산-하다(計算하다)
5231,셍기다,동사,이 말 저 말 자꾸 주워대다.,
5907,소갈이-하다,동사,소로 논밭을 갈다.,
6098,소겨리-하다,동사,겨리질을 할 수 있도록 겨리에 두 마리의 겨릿소를 짝을 지어 묶다.,
6211,소경낚시질-하다,동사,미늘이 없는 낚시로 물고기를 잡다.,
6216,소경놀이-하다,동사,눈을 싸매거나 가리어 볼 수 없도록 하여 무엇을 찾거나 잡거나 하는 놀이를 하다.,
6370,소곤-거리다,동사,남이 알아듣지 못하도록 작은 목소리로 자꾸 가만가만 이야기하다.,"비슷한말 소곤-대다, 소곤소곤-하다
참고 어휘 수군-거리다, 쏘곤-거리다"
6372,소곤닥-거리다,동사,남이 알아듣지 못하도록 작은 목소리로 어수선하게 자꾸 이야기하다.,"비슷한말 소곤닥-대다, 소곤닥소곤닥-하다
참고 어휘 수군덕-거리다, 쏘곤닥-거리다"
6373,소곤닥-대다,동사,남이 알아듣지 못하도록 작은 목소리로 어수선하게 자꾸 이야기하다.,비슷한말 소곤닥-거리다
6375,소곤닥소곤닥-하다,동사,남이 알아듣지 못하도록 작은 목소리로 자꾸 어수선하게 이야기하다.,비슷한말 소곤닥-거리다
6376,소곤닥-이다,동사,남이 알아듣지 못하도록 작은 목소리로 어수선하게 이야기하다.,
6379,소곤-대다,동사,남이 알아듣지 못하도록 작은 목소리로 자꾸 가만가만 이야기하다.,비슷한말 소곤-거리다
6381,소곤소곤-하다,동사,남이 알아듣지 못하도록 작은 목소리로 가만가만 자꾸 이야기하다.,비슷한말 소곤-거리다
6426,소곳소곳-하다,동사,여럿이 다 고개를 귀엽게 조금 숙이다.,
6431,소곳-하다,동사,고개를 귀엽게 조금 숙이다.,참고 어휘 수굿-하다
6798,소금구이-하다,동사,바닷물을 달여서 소금을 만들다.,
6836,소금물가리기-하다,동사,벼나 보리 따위의 씨를 소금물에 담가서 뜨는 것은 버리고 가라앉는 것은 종자용으로 가려내다.,"비슷한말 소금물고르기-하다, 염수선-하다(鹽水選하다)"
6838,소금물고르기-하다,동사,벼나 보리 따위의 씨를 소금물에 담가서 뜨는 것은 버리고 가라앉는 것은 종자용으로 가려내다.,"비슷한말 소금물가리기-하다, 염수선-하다(鹽水選하다)"
6896,소금절이-하다,동사,고기나 채소 따위를 소금으로 절이다.,비슷한말 염침-하다(鹽沈하다)
7083,소꿉놀이-하다,동사,소꿉을 가지고 노는 놀이를 하다.,
7087,소꿉장난-하다,동사,소꿉놀이를 하며 노는 장난을 하다.,
7093,소꿉질-하다,동사,아이들이 자질구레한 그릇 따위의 장난감을 가지고 살림살이하는 흉내를 내다.,
7877,소드락질-하다,동사,남의 재물 따위를 빼앗다.,비슷한말 노략질-하다(擄掠질하다)
8289,소록소록-하다,동사,아기가 곱게 자다.,
8581,소리-치다,동사,소리를 크게 지르다.,
8610,소리-하다,동사,판소리나 잡가를 부르다.,
8678,소마-보다,동사,‘소변보다’를 완곡하게 이르는 말.,
8868,소매치기-하다,동사,남의 몸이나 가방을 슬쩍 뒤져 금품을 훔치다.,
8908,소맷동냥-하다,동사,여러 집을 다니며 먹을 것을 얻어서 소매 안에 넣어 가지고 다니다.,
9121,소몰이-하다,동사,소를 몰고 다니다.,
10731,소수-나다,동사,땅의 농산물 소출이 늘다.,준말 솟-나다
10893,소스라-뜨리다,동사,깜짝 놀라 몸을 갑자기 솟구치듯 움직이다.,비슷한말 소스라-트리다
10897,소스라-지다,동사,위로 봉긋이 솟아나다.,
10898,소스라-치다,동사,깜짝 놀라 몸을 갑자기 떠는 듯이 움직이다.,
10899,소스라-트리다,동사,깜짝 놀라 몸을 갑자기 솟구치듯 움직이다.,비슷한말 소스라-뜨리다
10937,소스-치다,동사,몸을 위로 높게 올리다.,
11778,소용-돌다,동사,바닥이 깊이 팬 자리에서 물이 빙빙 돌면서 흐르다.,
11803,소용돌이-치다,동사,물이 빙빙 돌면서 흐르다.,
13387,소쿠라-지다,동사,급히 흐르는 물이 굽이쳐 용솟음치다.,비슷한말 솔다
14691,속가름-하다,동사,돈이나 물품의 총액을 적고 그것을 작게 잘라서 낱낱이 밝히다.,
14738,속감침-하다,동사,실밥이 보이지 아니하게 바늘을 깊숙이 넣어 감치다.,
14951,속-내다,동사,대패나 끌 따위의 무딘 날을 갈아 새로 날카로운 날이 서게 하다.,
14995,속다,동사,남의 거짓이나 꾀에 넘어가다.,
15003,속다짐-하다,동사,마음속으로 다짐하다.,
15005,속닥-거리다,동사,남이 알아듣지 못하도록 작은 목소리로 은밀하게 자꾸 이야기하다.,"비슷한말 속닥-대다, 속닥속닥-하다
참고 어휘 숙덕-거리다, 쏙닥-거리다"
15008,속닥-대다,동사,남이 알아듣지 못하도록 작은 목소리로 은밀하게 자꾸 이야기하다.,비슷한말 속닥-거리다
15013,속닥속닥-하다,동사,남이 알아듣지 못하도록 작은 목소리로 자꾸 은밀하게 이야기하다.,비슷한말 속닥-거리다
15015,속닥-이다,동사,남이 알아듣지 못하도록 작은 목소리로 은밀하게 이야기하다.,
15018,속닥질-하다,동사,(낮잡는 뜻으로) 저희들끼리만 알아들을 수 있을 정도의 낮은 목소리로 은밀하게 이야기하다.,
15031,속달-거리다,동사,남이 알아듣지 못하도록 작은 목소리로 조금 수선스럽게 자꾸 이야기하다.,"비슷한말 속달-대다, 속달속달-하다
참고 어휘 숙덜-거리다, 쏙달-거리다"
15032,속달-대다,동사,남이 알아듣지 못하도록 작은 목소리로 조금 수선스럽게 자꾸 이야기하다.,비슷한말 속달-거리다
15036,속달속달-하다,동사,남이 알아듣지 못하도록 작은 목소리로 자꾸 조금 수선스럽게 이야기하다.,비슷한말 속달-거리다
15065,속대중-하다,동사,마음속으로만 대강 짐작하다.,"비슷한말 속량-하다(속量하다), 속어림-하다, 속요량-하다(속料量하다), 속짐작-하다(속斟酌하다)
반대말 겉대중-하다"
15343,속말-하다,동사,속마음에서 우러나오는 말을 하다.,"비슷한말 심어-하다(深語하다)
반대말 겉말-하다"
15450,속받침-하다,동사,속에 받침을 대어 넣다.,
15580,속뽑이-하다,동사,남의 마음속을 알아내기 위하여 여러 가지 수단으로 넌지시 드러내어 놓게 하다.,
15632,속삭-거리다,동사,남이 알아듣지 못하도록 나지막한 목소리로 자꾸 가만가만 이야기하다.,"비슷한말 속삭-대다, 속삭속삭-하다"
15634,속삭-대다,동사,남이 알아듣지 못하도록 나지막한 목소리로 자꾸 가만가만 이야기하다.,비슷한말 속삭-거리다
15638,속삭속삭-하다,동사,남이 알아듣지 못하도록 나지막한 목소리로 가만가만 자꾸 이야기하다.,비슷한말 속삭-거리다
15640,속삭-이다,동사,남이 알아듣지 못하도록 나지막한 목소리로 가만가만 이야기하다.,
15659,속살-거리다,동사,남이 알아듣지 못하도록 작은 목소리로 자질구레하게 자꾸 이야기하다.,"비슷한말 속살-대다, 속살속살-하다
참고 어휘 숙설-거리다, 쏙살-거리다"
15660,속살-대다,동사,남이 알아듣지 못하도록 작은 목소리로 자질구레하게 자꾸 이야기하다.,비슷한말 속살-거리다
15665,속살속살-하다,동사,남이 알아듣지 못하도록 작은 목소리로 자꾸 자질구레하게 이야기하다.,비슷한말 속살-거리다
15695,속새질-하다,동사,까칠까칠한 물건의 표면을 매끄럽게 하려고 사포로 문지르다.,비슷한말 사포질-하다(沙布질하다)
15703,속생각-하다,동사,남모르게 마음속으로 생각하다.,
15815,속셈-하다,동사,연필이나 계산기 따위를 쓰지 아니하고 머릿속으로 계산하다.,
15887,속시침-하다,동사,바늘땀이 겉으로 드러나지 아니하게 천 안쪽을 시치다.,
15950,속앓이-하다,동사,속에 병이 생겨 아파하다.,
15960,속어림-하다,동사,마음속으로 짐작하여 헤아려 보다.,"비슷한말 속대중-하다, 속량-하다(속量하다), 속요량-하다(속料量하다), 속짐작-하다(속斟酌하다)
반대말 겉어림-하다"
16152,속임질-하다,동사,속이는 짓을 하다.,
16397,속치레-하다,동사,속을 잘 꾸미어 모양을 내다.,"반대말 겉치레-하다, 눈치레-하다, 연식-하다(緣飾하다), 외식-하다(外飾하다)"
16481,속풀이-하다,동사,전날의 마신 술로 거북해진 속을 가라앉히다.,
16580,솎기-하다,동사,촘촘히 나 있는 푸성귀나 곡식 따위를 군데군데 골라 뽑아 성기게 하다.,비슷한말 솎음-하다
16581,솎다,동사,촘촘히 있는 것을 군데군데 골라 뽑아 성기게 하다.,
16584,솎아베기-하다,동사,나무를 잘 자라게 하기 위하여 불필요한 나무를 제거하다.,
16596,솎음질-하다,동사,배게 난 채소 따위를 솎아 내다.,
16598,솎음-하다,동사,촘촘히 나 있는 푸성귀나 곡식 따위를 군데군데 골라 뽑아 성기게 하다.,비슷한말 솎기-하다
16633,손가늠-하다,동사,손으로 대충 길이를 재다.,
16711,손가락질-하다,동사,손가락으로 가리키다.,
16762,손-겪다,동사,손을 대접하다.,비슷한말 손겪이-하다
16764,손겪이-하다,동사,손을 대접하여 치르다.,"비슷한말 손-겪다, 손님겪이-하다, 손님치레-하다"
16893,손-꼽다,동사,손가락을 하나씩 고부리며 수를 헤아리다.,
16899,손꼽이-치다,동사,손에 꼽을 만큼 상위권에 들다.,
16993,손놀림-하다,동사,손을 이리저리 움직이다.,
17000,손누비-하다,동사,옷감이나 옷 따위를 손으로 누비다.,
17014,손님겪이-하다,동사,손을 대접하여 치르다.,"비슷한말 손겪이-하다, 손님치레-하다"
17021,손님맞이-하다,동사,오는 손님을 맞아들이다.,비슷한말 손맞이-하다
17037,손님치레-하다,동사,손을 대접하여 치르다.,"비슷한말 손겪이-하다, 손님겪이-하다"
17044,손님-하다,동사,천연두를 앓다.,"비슷한말 마마-하다(媽媽하다), 손님마마-하다(손님媽媽하다)"
17047,손다듬이-하다,동사,방망이를 쓰지 아니하고 손으로 대충 두드려서 다듬다.,
17050,손다리미-하다,동사,다리미로 다리는 대신 손으로 잡아당기거나 문질러서 구김살을 펴다.,
17065,손-대다,동사,손으로 만지거나 건드리다.,
17079,손대중-하다,동사,손으로 쥐거나 들어 보아 어림으로 헤아리다.,비슷한말 손어림-하다
17085,손더듬이-하다,동사,무엇을 찾으려고 손으로 더듬다.,
17133,손-들다,동사,자기의 능력에서 벗어나 포기하다.,
17176,손뜨개질-하다,동사,손으로 뜨개질을 하다.,
17211,손맞이-하다,동사,오는 손님을 맞아들이다.,비슷한말 손님맞이-하다
17387,손바꿈-하다,동사,일할 때 능한 솜씨를 서로 바꾸다.,비슷한말 환수-하다(換手하다)
17392,손바느질-하다,동사,기계를 쓰지 아니하고 직접 손으로 바느질하다.,
17599,손-보다,동사,찾아온 손님을 만나 보다.,
17649,손빨래-하다,동사,세탁기를 쓰지 아니하고 손으로 직접 빨래하다.,비슷한말 손세탁-하다(손洗濯하다)
17669,손사랫짓-하다,동사,손을 펴서 함부로 휘젓다.,
17902,손심부름-하다,동사,몸 가까이 있는 일에 대한 자질구레한 심부름을 하다.,
17909,손-쓰다,동사,어떤 일에 필요한 조치를 취하다.,
17915,손씻이-하다,동사,남의 수고에 보답하는 마음으로 적은 물건을 주다.,
17965,손어림-하다,동사,손으로 만지거나 들어 보아 대강 헤아리다.,"비슷한말 손대중-하다, 손짐작-하다(손斟酌하다)"
18149,손일-하다,동사,손을 움직여서 일하다.,"비슷한말 손노동-하다(손勞動하다), 손작업-하다(손作業하다)"
18191,손-잡다,동사,손과 손을 마주 잡다.,
18216,손장난-하다,동사,쓸데없이 손을 놀려서 장난하다.,
18316,손질-되다,동사,손이 가서 잘 매만져지다.,
18318,손질-하다,동사,손을 대어 잘 매만지다.,
18339,손짓-하다,동사,손을 놀려 어떤 사물을 가리키거나 자기의 생각을 남에게 전달하다.,
18354,손짭손-하다,동사,좀스럽고 얄망궂게 손장난을 하다.,
18357,손찌검-하다,동사,손으로 남을 때리다.,
18376,손-치다,동사,물건을 매만져 바로잡다.,
18516,손풀무질-하다,동사,손풀무로 바람을 일으키다.,
18807,솔다,동사,물기가 있던 것이나 상처 따위가 말라서 굳어지다.,
19203,솔잎뜨기-하다,동사,"코바늘뜨기에서, 솔잎 묶음 모양의 무늬를 만들어 내다.",
19253,솔질-하다,동사,솔로 먼지 따위를 떨거나 닦다.,
19261,솔찜질-하다,동사,주로 병을 고치기 위하여 솔잎으로 찜질을 하다. 온몸에 솔잎을 덮고 방에 불을 덥게 때어 솔잎의 김을 쐬어서 땀을 낸다.,비슷한말 솔찜-하다
19262,솔찜-하다,동사,주로 병을 고치기 위하여 솔잎으로 찜질을 하다. 온몸에 솔잎을 덮고 방에 불을 덥게 때어 솔잎의 김을 쐬어서 땀을 낸다.,비슷한말 솔찜질-하다
19490,솝뜨다,동사,아래에서 위로 솟아 떠오르다.,
19513,솟고라-지다,동사,용솟음치며 끓어오르다.,
19516,솟-구다,동사,몸 따위를 빠르고 세게 날 듯이 높이 솟게 하다.,
19521,솟구-치다,동사,"아래에서 위로, 또는 안에서 밖으로 세차게 솟아오르다.",비슷한말 치-솟다
19533,솟다,동사,"연기와 같은 물질이나 비행기와 같은 물체가 아래에서 위로, 또는 속에서 겉으로 세차게 움직이다.",
19563,솟-보다,동사,물건을 자세히 살피지 않아 원래의 가치보다 비싼 값으로 사다.,
19565,솟아-나다,동사,안에서 밖으로 나오다.,
19568,솟아-오르다,동사,아래에서 위로 또는 안에서 밖으로 불쑥 나타나다.,
19608,솟-치다,동사,느낌 따위가 세차게 일어나다.,
19738,송곳질-하다,동사,송곳으로 구멍을 뚫으려고 자꾸 찌르다.,
19837,송그리다,동사,몸을 작게 오그리다.,
19966,송당-거리다,동사,연한 물건을 조금 작고 거칠게 자꾸 빨리 썰다.,"비슷한말 송당-대다, 송당송당-하다"
19968,송당-대다,동사,연한 물건을 조금 작고 거칠게 자꾸 빨리 썰다.,비슷한말 송당-거리다
19975,송당송당-하다,동사,연한 물건을 자꾸 조금 작고 거칠게 빨리 썰다.,비슷한말 송당-거리다
20732,송장치레-하다,동사,죽은 사람에게 수의를 해 입히고 관을 마련하고 장사를 지내다.,
21985,쇠-나다,동사,솥에 난 녹이 음식에 물들다.,
22012,쇠다,동사,채소가 너무 자라서 줄기나 잎이 뻣뻣하고 억세게 되다.,
