,어휘,품사,뜻풀이,관련 어휘
38520,거들먹거들먹-하다,동사,신이 나서 잘난 체하며 함부로 자꾸 거만하게 행동하다.,"비슷한말 거들먹-거리다, 거들먹-대다"
38521,거들먹-거리다,동사,신이 나서 잘난 체하며 자꾸 함부로 거만하게 행동하다.,"비슷한말 거들먹-대다, 거들먹거들먹-하다
참고 어휘 가들막-거리다, 꺼들먹-거리다"
38522,거들먹-대다,동사,신이 나서 잘난 체하며 자꾸 함부로 거만하게 행동하다.,"비슷한말 거들먹-거리다, 거들먹거들먹-하다
참고 어휘 가들막-대다, 꺼들먹-대다"
38523,거들먹-이다,동사,신이 나서 잘난 체하며 함부로 거만하게 행동하다.,
38547,거듬거듬-하다,동사,흩어져 있거나 널려 있는 것들을 대강 자꾸 모으다.,"비슷한말 거듬-거리다, 주섬주섬-하다"
38548,거듬-거리다,동사,흩어져 있거나 널려 있는 것을 자꾸 대강 거두다.,"비슷한말 거듬거듬-하다, 주섬주섬-하다"
38551,거듭-나다,동사,원죄 때문에 죽었던 영이 예수를 믿음으로 해서 영적으로 다시 새사람이 되다.,비슷한말 중생-하다(重生하다)
38556,거듭-되다,동사,어떤 일이나 상황이 계속 생겨나거나 되풀이되다.,
38583,거듭제곱-하다,동사,같은 수나 식을 거듭 곱하다.,비슷한말 누승-하다(累乘하다)
38589,거듭-하다,동사,어떤 일을 자꾸 되풀이하다.,
38666,거랑-하다,동사,광산 구덩이의 버력탕 같은 데서 광석이나 사금을 골라내다.,
38924,거레-하다,동사,까닭 없이 지체하며 매우 느리게 움직이다.,
38963,거루다,동사,배 따위를 강가나 냇가에 대다.,
39005,거르기-하다,동사,거름종이나 여과기를 써서 액체 속에 들어 있는 침전물이나 입자를 걸러 내다.,비슷한말 여과-하다(濾過하다)
39006,거르다,동사,찌꺼기나 건더기가 있는 액체를 체나 거름종이 따위에 밭쳐서 액체만 받아 내다.,
39105,거름-하다,동사,거름을 주다.,
39179,거리끼다,동사,일이나 행동 따위를 하는 데에 걸려서 방해가 되다.,"비슷한말 방애-되다(妨礙되다), 방해-되다(妨害되다), 장애-되다(障礙되다), 저해-되다(沮害되다)"
39417,거머-당기다,동사,휘감아 당기다.,
39420,거머-들이다,동사,휘몰아 들이다.,
39441,거머-먹다,동사,이것저것 욕심스럽게 급히 걷어 먹다.,
39457,거머-삼키다,동사,이것저것 욕심스럽게 급히 걷어 삼키다.,
39459,거머-안다,동사,두 팔로 휘감듯이 안다.,
39462,거머-잡다,동사,손으로 휘감아 잡다.,준말 검-잡다
39464,거머-쥐다,동사,틀어잡거나 휘감아 쥐다.,준말 검-쥐다
39471,거머-채다,동사,휘감아 잡아채다.,
39493,거멀다,동사,두 물체 사이를 벌어지지 않게 하다.,
39507,거멀장-하다,동사,두 물건 사이를 벌어지지 못하게 연결하다.,비슷한말 거멀-하다
39511,거멀-하다,동사,두 물건 사이를 벌어지지 못하게 연결하다.,비슷한말 거멀장-하다
39526,거메-지다,동사,거멓게 되다.,"참고 어휘 가매-지다, 꺼메-지다"
39668,거물-거리다,동사,약한 불빛 따위가 사라질 듯 말 듯 움직이다.,"비슷한말 거물-대다, 거물거물-하다
참고 어휘 가물-거리다, 꺼물-거리다"
39674,거물거물-하다,동사,약한 불빛 따위가 사라질 듯 말 듯 자꾸 움직이다.,비슷한말 거물-거리다
39682,거물-대다,동사,약한 불빛 따위가 사라질 듯 말 듯 움직이다.,비슷한말 거물-거리다
39812,거미-치밀다,동사,부러움과 시새움으로 욕심이 치밀어 오르다.,
40058,거불-거리다,동사,거볍게 자꾸 흔들려 움직이다. 또는 그렇게 하다.,"비슷한말 거불-대다, 거불거불-하다
참고 어휘 가불-거리다, 꺼불-거리다"
40062,거불거불-하다,동사,거볍게 흔들려 자꾸 움직이다. 또는 그렇게 하다.,비슷한말 거불-거리다
40064,거불-대다,동사,거볍게 자꾸 흔들려 움직이다. 또는 그렇게 하다.,비슷한말 거불-거리다
40071,거불-지다,동사,둥글고 두두룩하게 툭 비어져 나오다.,
40141,거사리다,동사,긴 것을 힘 있게 빙빙 돌려서 포개어지게 하다.,
40293,거세어-지다,동사,거세게 되다.,준말 거세-지다
40390,거스러-지다,동사,잔털 따위가 거칠게 일어나다.,참고 어휘 가스러-지다
40400,거스르다,동사,일이 돌아가는 상황이나 흐름과 반대되거나 어긋나는 태도를 취하다.,
40438,거슬리다,동사,순순히 받아들여지지 않고 언짢은 느낌이 들며 기분이 상하다.,
40601,거식-하다,동사,"말하는 중에 표현하려는 동사가 얼른 생각이 나지 않거나 바로 말하기 곤란할 때에, 그 대신으로 쓰는 말.",
40794,거우다,동사,집적거려 성나게 하다.,
40800,거우르다,동사,속에 든 것이 쏟아지도록 기울이다.,
40847,거울-삼다,동사,남의 일이나 지나간 일을 보아 본받거나 경계하다.,
40871,거울-지다,동사,되비치어 보이다.,
41024,거장-치다,동사,크게 거들먹거리며 세상을 어지럽히고 괴롭히다.,
41061,거저-먹다,동사,힘을 들이지 아니하고 일을 해내거나 어떤 것을 차지하다.,비슷한말 공-먹다(空먹다)
41065,거저-줍다,동사,아무런 조건이나 힘들임 없이 집거나 얻다.,
41549,거짓말-하다,동사,사실이 아닌 것을 사실인 것처럼 꾸며 대어 말하다.,"비슷한말 뻥-까다, 뻥-놓다, 사언-하다(詐言하다), 양언-하다(佯言하다), 허사-하다(虛辭하다), 허언-하다(虛言하다)"
41863,거추-하다,동사,보살피어 치다꺼리하다.,
41903,거치다,동사,무엇에 걸리거나 막히다.,
41965,거치적-거리다,동사,거추장스럽게 자꾸 여기저기 거치거나 닿다.,"비슷한말 거치적-대다, 거치적거치적-하다
참고 어휘 가치작-거리다, 꺼치적-거리다"
41969,거치적거치적-하다,동사,거추장스럽게 여기저기 자꾸 거치거나 닿다.,비슷한말 거치적-거리다
41971,거치적-대다,동사,거추장스럽게 자꾸 여기저기 거치거나 닿다.,비슷한말 거치적-거리다
42054,거칠어-지다,동사,거친 상태로 되다.,
42067,거칫-거리다,동사,살갗 따위에 자꾸 닿아 걸리다.,"비슷한말 거칫-대다, 거칫거칫-하다
참고 어휘 가칫-거리다, 꺼칫-거리다"
42072,거칫거칫-하다,동사,살갗 따위에 닿아 자꾸 걸리다.,비슷한말 거칫-거리다
42075,거칫-대다,동사,살갗 따위에 자꾸 닿아 걸리다.,비슷한말 거칫-거리다
42204,거푸짓기-하다,동사,같은 땅에 같은 작물을 해마다 심어 가꾸다.,"비슷한말 연작-하다(連作하다), 이어갈이-하다, 이어짓기-하다"
42205,거푸-하다,동사,잇따라 거듭하다.,
42207,거푼-거리다,동사,물체의 한 부분이 바람에 떠들려 가볍게 자꾸 움직이다.,"비슷한말 거푼-대다, 거푼거푼-하다"
42209,거푼거푼-하다,동사,물체의 한 부분이 바람에 떠들려 자꾸 가볍게 움직이다.,비슷한말 거푼-거리다
42210,거푼-대다,동사,물체의 한 부분이 바람에 떠들려 가볍게 자꾸 움직이다.,비슷한말 거푼-거리다
42216,거풀-거리다,동사,물체의 한 부분이 바람에 떠들려 자꾸 크게 흔들리다.,"비슷한말 거풀-대다, 거풀거풀-하다"
42218,거풀거풀-하다,동사,물체의 한 부분이 바람에 떠들려 크게 자꾸 흔들리다.,비슷한말 거풀-거리다
42219,거풀-대다,동사,물체의 한 부분이 바람에 떠들려 자꾸 크게 흔들리다.,비슷한말 거풀-거리다
42330,거풋-거리다,동사,물체의 한 부분이 바람 따위에 떠들려 가볍고 빠르게 자꾸 움직이다.,"비슷한말 거풋-대다, 거풋거풋-하다"
42332,거풋거풋-하다,동사,물체의 한 부분이 바람 따위에 떠들려 자꾸 가볍고 빠르게 움직이다.,비슷한말 거풋-거리다
42333,거풋-대다,동사,물체의 한 부분이 바람 따위에 떠들려 가볍고 빠르게 자꾸 움직이다.,비슷한말 거풋-거리다
42475,걱실-거리다,동사,성질이 너그러워 말과 행동을 시원시원하게 하다.,"비슷한말 걱실-대다, 걱실걱실-하다"
42478,걱실걱실-하다,동사,성질이 너그러워 말과 행동을 시원스럽게 하다.,비슷한말 걱실-거리다
42482,걱실-대다,동사,성질이 너그러워 말과 행동을 시원시원하게 하다.,비슷한말 걱실-거리다
42491,걱정걱정-하다,동사,몹시 걱정하다.,
42502,걱정-되다,동사,안심이 되지 않아 속이 타다.,비슷한말 근심-되다
42512,걱정-하다,동사,안심이 되지 않아 속을 태우다.,비슷한말 근심-하다
42966,건너-가다,동사,무엇을 사이에 두고 이쪽에서 저쪽 맞은편으로 가다.,반대말 건너-오다
42972,건너-긋다,동사,줄 따위를 한쪽에서 다른 쪽까지 직선으로 죽 긋다.,비슷한말 건너-지르다
42975,건너다,동사,무엇을 사이에 두고 한편에서 맞은편으로 가다.,
42978,건너-다니다,동사,어떤 곳을 건너서 왔다 갔다 하다.,
42984,건너다-보다,동사,건너편에 있는 것을 쳐다보다.,비슷한말 건너-보다
42989,건너-대다,동사,물을 건너서 반대편에 도달하다.,
43002,건너-뛰다,동사,일정한 공간을 사이에 두고 건너편으로 뛰다.,비슷한말 넘다
43011,건너-막다,동사,한쪽에서 다른 쪽까지 죽 질러서 막다.,
43016,건너-보내다,동사,건너가게 하다.,
43017,건너-보다,동사,건너편에 있는 것을 쳐다보다.,비슷한말 건너다-보다
43020,건너-서다,동사,건너서 맞은편에 옮아 서다.,
43021,건너-앉다,동사,이쪽에서 저쪽으로 건너가서 앉다.,
43023,건너-오다,동사,무엇을 사이에 두고 저쪽 맞은편에서 이쪽으로 오다.,반대말 건너-가다
43025,건너-지르다,동사,마주 보이는 두 곳의 한쪽에서 다른 쪽까지 두 끝이 닿도록 긴 물건을 가로놓다.,
43027,건너-지피다,동사,강물이 이쪽 끝에서 저쪽 끝까지 모두 얼어붙다.,"비슷한말 건너질리다, 합빙-하다(合氷하다)"
43030,건너질리다,동사,강물이 이쪽 끝에서 저쪽 끝까지 모두 얼어붙다.,비슷한말 건너-지피다
43031,건너-짚다,동사,중간에 무엇을 넘거나 건너서 팔을 내밀어 짚거나 발로 디디다.,
43078,건네다,동사,돈이나 물건 따위를 남에게 옮기다.,
43088,건네-받다,동사,남으로부터 물건을 옮기어 받다.,반대말 건네-주다
43096,건네-주다,동사,"돈, 물건 따위를 남에게 옮기어 주다.",반대말 건네-받다
43244,건덩-거리다,동사,달려 있는 물체가 거볍게 자꾸 흔들리다.,"비슷한말 건덩-대다, 건덩건덩-하다
참고 어휘 간당-거리다"
43246,건덩건덩-하다,동사,달려 있는 물체가 자꾸 거볍게 흔들리다.,비슷한말 건덩-거리다
43247,건덩-대다,동사,달려 있는 물체가 거볍게 자꾸 흔들리다.,비슷한말 건덩-거리다
43248,건덩-이다,동사,달려 있는 물체가 거볍게 흔들리다.,
43296,건둥건둥-하다,동사,하나도 흩어지지 않게 멀끔히 가다듬어 수습하다.,
43299,건둥-그리다,동사,하나도 흩어지지 않게 말끔히 가다듬어 수습하다.,"참고 어휘 간동-그리다, 껀둥-그리다"
43301,건둥반둥-하다,동사,일을 다 끝내지 못하고 중도에서 성의 없이 그만두다.,비슷한말 반둥건둥-하다
43324,건드리다,동사,조금 움직일 만큼 손으로 만지거나 무엇으로 대다.,준말 건들다
43343,건득-거리다,동사,졸음이 와서 고개를 힘없이 앞으로 자꾸 숙였다 들었다 하다.,비슷한말 건득-대다
43345,건득건득-하다,동사,졸음이 와서 고개를 힘없이 자꾸 앞으로 숙였다 들다.,
43347,건득-대다,동사,졸음이 와서 고개를 힘없이 앞으로 자꾸 숙였다 들었다 하다.,비슷한말 건득-거리다
43352,건들-거리다,동사,바람이 부드럽게 살랑살랑 불다.,"비슷한말 건들-대다, 건들건들-하다
참고 어휘 간들-거리다"
43362,건들건들-하다,동사,바람이 거볍고 부드럽게 살랑거리며 불다.,비슷한말 건들-거리다
43371,건들-대다,동사,바람이 부드럽게 살랑살랑 불다.,"비슷한말 건들-거리다
참고 어휘 간들-대다"
43581,건몰다,동사,일을 정성 들이지 않고 건성건성 빨리 해 나가다.,
43791,건사-하다,동사,제게 딸린 것을 잘 보살피고 돌보다.,
44075,건성질-하다,동사,(낮잡는 뜻으로) 주의를 기울이거나 정성을 들이지 않고 마구 덤벙이다.,
44449,건잠머리-하다,동사,일을 시킬 때에 대강의 방법을 일러 주고 필요한 여러 도구를 챙겨 주다.,
44526,건정-거리다,동사,일을 빨리빨리 적당히 해치우다.,"비슷한말 건정-대다, 건정건정-하다"
44529,건정건정-하다,동사,일을 적당히 빨리빨리 해치우다.,비슷한말 건정-거리다
44531,건정-대다,동사,일을 빨리빨리 적당히 해치우다.,비슷한말 건정-거리다
44837,건중건중-하다,동사,흐트러진 일이나 물건을 대강대강 가리고 골라서 가지런하게 하다.,"비슷한말 건중-그리다, 건중-이다"
44838,건중-그리다,동사,흐트러진 일이나 물건을 대강대강 가리고 골라서 가지런하게 하다.,"비슷한말 건중-이다, 건중건중-하다
참고 어휘 간종-그리다"
44841,건중-이다,동사,흐트러진 일이나 물건을 대강대강 가리고 골라서 가지런하게 하다.,"비슷한말 건중-그리다, 건중건중-하다
참고 어휘 간종-이다"
44859,건지다,동사,물속에 들어 있거나 떠 있는 것을 집어내거나 끌어내다.,반대말 빠-뜨리다
45416,걷다,동사,구름이나 안개 따위가 흩어져 없어지다.,
45430,걷-몰다,동사,거듬거듬 빨리 몰아치다.,
45437,걷어-들다,동사,거두어서 손에 들다.,
45440,걷어-매다,동사,일을 하다가 중간에서 대충 끝맺다.,
45441,걷어-붙이다,동사,소매나 바짓가랑이 따위를 말아 올리다.,
45445,걷어-안다,동사,거두어서 품에 안다.,
45449,걷어-입다,동사,옷을 되는대로 마구 입다.,
45450,걷어-잡다,동사,걷어 올려서 잡다.,비슷한말 걷어-쥐다
45453,걷어-쥐다,동사,걷어 올려서 쥐다.,비슷한말 걷어-잡다
45456,걷어-지르다,동사,옷자락이나 휘장 따위를 걷어서 내려오지 못하게 꽂아 놓다.,준말 걷-지르다
45459,걷어-질리다,동사,기운이 없거나 병이 나서 눈꺼풀이 맥없이 열리고 눈알이 우묵해지다.,
45461,걷어-차다,동사,발을 들어서 세게 차다.,
45476,걷어-치우다,동사,흩어진 것을 거두어 치우다.,
45480,걷-잡다,동사,한 방향으로 치우쳐 흘러가는 형세 따위를 붙들어 잡다.,
45483,걷-지르다,동사,말이나 일이 이어지던 것을 중간에서 끊다.,
45532,걸걸-거리다,동사,음식이나 재물에 욕심을 부려 자꾸 염치없이 굴다.,비슷한말 걸걸-대다
45533,걸걸-대다,동사,음식이나 재물에 욕심을 부려 자꾸 염치없이 굴다.,비슷한말 걸걸-거리다
45535,걸걸-하다,동사,음식이나 재물에 욕심을 부려 염치없이 굴다.,
45550,걸고-넘어지다,동사,자신의 책임이나 죄에 상관도 없는 사람을 거론하여 트집을 잡다.,
45610,걸근-거리다,동사,목구멍에 가래 따위가 걸려 자꾸 간지럽게 거치적거리다.,"비슷한말 걸근-대다, 걸근걸근-하다
참고 어휘 갈근-거리다"
45614,걸근걸근-하다,동사,목구멍에 가래 따위가 걸려 자꾸 간지럽게 거치적거치적하다.,비슷한말 걸근-거리다
45616,걸근-대다,동사,목구멍에 가래 따위가 걸려 자꾸 간지럽게 거치적거리다.,비슷한말 걸근-거리다
45642,걸기질-하다,동사,논바닥을 평평하게 고르다.,
45671,걸다,동사,벽이나 못 따위에 어떤 물체를 떨어지지 않도록 매달아 올려놓다.,
45694,걸-달다,동사,"걸인들의 은어로, ‘동냥하다’를 이르는 말.",
45714,걸-뜨다,동사,물 표면에 뜨지 아니하고 중간에 뜨다.,
45717,걸-뜨리다,동사,걸쳐서 아래로 늘어뜨리다.,
45737,걸러-뛰다,동사,차례의 중간에서 일부 차례를 거치지 아니하고 뛰어넘다.,비슷한말 건너-뛰다
45778,걸레질-하다,동사,더러움이나 때를 걸레로 닦거나 훔치다.,
45791,걸려-들다,동사,그물이나 낚시 따위에 걸리어 벗어나지 못하게 되다.,
45831,걸-리다,동사,해나 달이 떠 있다.,
45848,걸리다,동사,"윷놀이에서, 말을 걸밭으로 올리다.",
45858,걸리적-거리다,동사,거추장스럽게 자꾸 여기저기 걸리거나 닿다.,비슷한말 걸리적-대다
45860,걸리적-대다,동사,거추장스럽게 자꾸 여기저기 걸리거나 닿다.,비슷한말 걸리적-거리다
45916,걸머-맡다,동사,남의 일이나 빚 따위를 대신 책임지다.,
45917,걸머-메다,동사,한쪽 어깨에 걸치어 놓다.,비슷한말 걸-메다
45919,걸머-잡다,동사,한데 걸치어 잡다.,
45920,걸머-쥐다,동사,걸치어 움켜잡다.,
45921,걸머-지다,동사,짐을 줄로 묶어 어깨에 걸거나 등에 걸치어 들다.,
45925,걸-먹다,동사,다른 사람 때문에 해를 당하여 골탕을 먹다.,비슷한말 언걸-먹다
45926,걸-메다,동사,한쪽 어깨에 걸치어 놓다.,비슷한말 걸머-메다
46060,걸씬-하다,동사,겨우 닿고 말다.,
46066,걸-앉다,동사,높은 곳에 궁둥이를 붙이고 두 다리를 늘어뜨리고 앉다.,비슷한말 걸어-앉다
46071,걸어-가다,동사,목적지를 향하여 발로 걸어서 나아가다.,반대말 걸어-오다
46079,걸어-앉다,동사,높은 곳에 궁둥이를 붙이고 두 다리를 늘어뜨리고 앉다.,비슷한말 걸-앉다
46081,걸어-오다,동사,목적지를 향하여 발로 걸어서 이동하여 오다.,반대말 걸어-가다
46213,걸-입다,동사,다른 사람 때문에 해를 당하다.,비슷한말 언걸-입다
46262,걸쩍-거리다,동사,활달하고 시원스럽게 행동하다.,"비슷한말 걸쩍-대다, 걸쩍걸쩍-하다"
46264,걸쩍걸쩍-하다,동사,활달하고 조금 시원스럽게 행동하다.,비슷한말 걸쩍-거리다
46265,걸쩍-대다,동사,활달하고 시원스럽게 행동하다.,비슷한말 걸쩍-거리다
46299,걸-채이다,동사,발이 걸려서 내어 지름을 당하다.,
46314,걸치다,동사,지는 해나 달이 산이나 고개 따위에 얹히다.,
46353,걸-타다,동사,걸쳐 있다.,
46362,걸태질-하다,동사,(낮잡는 뜻으로) 염치나 체면을 차리지 않고 재물 따위를 마구 긁어모으다.,
46363,걸터-넘다,동사,어떤 물체의 위를 걸치고 넘다.,
46364,걸터-눕다,동사,어떤 물체의 위를 걸치고 눕다.,
46365,걸터-들이다,동사,이것저것 가리지 않고 휘몰아 들이다.,
46366,걸터듬다,동사,무엇을 찾느라고 이것저것을 되는대로 마구 더듬다.,
46369,걸터-먹다,동사,이것저것 닥치는 대로 휘몰아 먹다.,
46371,걸터-앉다,동사,어떤 물체에 온몸의 무게를 실어 걸치고 앉다.,
46375,걸터-타다,동사,소나 말 따위의 등에 모로 앉아 두 다리를 늘어뜨리고 타다.,
46495,검-기다,동사,검게 더럽히다.,
46499,검-기울다,동사,검은 구름이 퍼져서 해가 가려지고 날이 차차 어두워지다.,
46520,검다,동사,흩어진 물건을 손이나 갈퀴 따위로 긁어모으다.,
46612,검-뜯다,동사,거머잡고 쥐어뜯다.,
46793,검붉어-지다,동사,검은빛을 띠면서 붉게 되어 가다.,
47198,검실-거리다,동사,"사람이나 물체, 빛 따위가 먼 곳에서 어렴풋이 자꾸 움직이다.","비슷한말 검실-대다, 검실검실-하다
참고 어휘 감실-거리다"
47201,검실검실-하다,동사,"사람이나 물건, 빛 따위가 먼 곳에서 자꾸 어렴풋이 움직이다.",비슷한말 검실-거리다
47203,검실-대다,동사,"사람이나 물체, 빛 따위가 먼 곳에서 어렴풋이 자꾸 움직이다.",비슷한말 검실-거리다
47250,검어-지다,동사,검게 되다.,
47661,검접-하다,동사,검질기게 붙잡고 놓지 않다. 또는 꼭 달라붙다.,
48046,검치다,동사,모서리를 중심으로 두 면에 걸치도록 하여 접거나 휘어 붙이다.,
48115,검퍼레-지다,동사,검퍼렇게 되다.,참고 어휘 감파래-지다
48152,검-흐르다,동사,액체가 그릇이나 둑 따위에서 넘쳐흐르다.,
48390,것-지르다,동사,아래에서 위로 거슬러 지르다.,
48425,겅더리-되다,동사,심하게 앓거나 큰 고통을 겪어서 몸이 몹시 파리하고 뼈가 앙상하게 되다.,참고 어휘 껑더리-되다
48428,겅둥-거리다,동사,긴 다리로 계속해서 거볍게 뛰다.,"비슷한말 겅둥-대다, 겅둥겅둥-하다
참고 어휘 껑둥-거리다"
48432,겅둥겅둥-하다,동사,조금 긴 다리로 거볍게 계속해서 뛰다.,비슷한말 겅둥-거리다
48434,겅둥-대다,동사,긴 다리로 계속해서 거볍게 뛰다.,비슷한말 겅둥-거리다
48456,겅정-거리다,동사,긴 다리를 모으고 거볍게 자꾸 내뛰다.,"비슷한말 겅정-대다, 겅정겅정-하다
참고 어휘 껑쩡-거리다, 껑청-거리다"
48459,겅정겅정-하다,동사,긴 다리를 모으고 자꾸 거볍게 내뛰다.,비슷한말 겅정-거리다
48460,겅정-대다,동사,긴 다리를 모으고 거볍게 자꾸 내뛰다.,비슷한말 겅정-거리다
48465,겅중-거리다,동사,긴 다리를 모으고 힘 있게 계속 솟구쳐 뛰다.,"비슷한말 겅중-대다, 겅중겅중-하다
참고 어휘 강종거리다, 껑쭝-거리다, 껑충-거리다"
48467,겅중겅중-하다,동사,긴 다리를 모으고 계속 힘 있게 솟구쳐 뛰다.,비슷한말 겅중-거리다
48468,겅중-대다,동사,긴 다리를 모으고 힘 있게 계속 솟구쳐 뛰다.,비슷한말 겅중-거리다
48497,겉갈이-하다,동사,잡초나 해충 따위를 없애려고 추수가 끝난 뒤에 논밭의 겉을 얇게 갈아엎다.,
48543,겉-꾸리다,동사,겉모양을 좋게 꾸미다.,
48546,겉꾸림-하다,동사,속에 있는 언짢은 점이 드러나지 않게 겉만을 잘 꾸미다.,
48547,겉-꾸미다,동사,겉만을 그럴듯하게 꾸미다.,비슷한말 겉치레-하다
48553,겉-날리다,동사,겉으로만 어름어름하여 일을 되는대로 날려서 하다.,
48559,겉-넘다,동사,신중하게 생각하지 않고 대충 짐작하여 행동하다.,
48560,겉-녹다,동사,겉으로만 조금 녹다.,
48561,겉-놀다,동사,다른 것과 서로 잘 어울리지 못하고 따로 놀다.,비슷한말 겉-돌다
48568,겉-늙다,동사,나이보다 더 늙은 티가 나다.,
48585,겉대중-하다,동사,겉으로만 보고 대강 짐작하다.,"비슷한말 겉어림-하다, 겉짐작-하다(겉斟酌하다)
반대말 속대중-하다"
48593,겉-돌다,동사,사물이 한데 섞이지 않고 따로따로 되다.,
48611,겉뜨기-하다,동사,대바늘 두 개를 사용하여 코를 겉으로만 감아 떠 나가다.,
48613,겉-뜨이다,동사,겉으로 나타나 눈에 뜨이다.,준말 겉-띄다
48618,겉-마르다,동사,속에는 물기가 남아 있고 겉만 대강 마르다.,
48625,겉말-하다,동사,마음으로는 그렇지 않으면서 겉으로만 꾸며 말하다.,반대말 속말-하다
48626,겉-맞추다,동사,마음으로는 내키지 않으면서 겉으로만 슬슬 발라맞추다.,
48677,겉-묻다,동사,남이 하는 김에 덩달아 따르다.,
48688,겉-바르다,동사,속의 잘못된 점은 그대로 두고 겉으로만 흠이 없게 꾸미다.,
48696,겉발림-하다,동사,겉만 그럴듯하게 꾸미어 남을 속이다.,
48811,겉어림-하다,동사,겉으로만 보고 대강 헤아리다.,"비슷한말 겉대중-하다, 겉짐작-하다(겉斟酌하다)
반대말 속어림-하다"
48814,겉-여물다,동사,곡식의 낟알이 속은 여물지 못하고 겉으로 보기에만 여물다.,
48843,겉-잡다,동사,겉으로 보고 대강 짐작하여 헤아리다.,
48857,겉-절이다,동사,김치를 담글 때 배추 따위의 숨을 죽이려고 소금을 뿌려 애벌로 절이다.,
48947,겉치레-하다,동사,겉만 보기 좋게 꾸미어 드러내다.,"비슷한말 겉-꾸미다, 눈치레-하다, 연식-하다(緣飾하다), 외식-하다(外飾하다)
반대말 속치레-하다"
48976,겉핥기-하다,동사,속 내용은 제대로 파악하지도 못하고 겉만 슬쩍 보아 넘기다.,
48977,겉-핥다,동사,내용을 제대로 파악하지 못하고 겉만 어물어물하여 넘기다.,
49026,게걸-거리다,동사,상스러운 말로 소리를 지르며 불평스럽게 자꾸 떠들다.,"비슷한말 게걸-대다, 게걸게걸-하다"
49028,게걸게걸-하다,동사,상스러운 말로 소리를 지르며 불평스럽게 자꾸 떠들다.,비슷한말 게걸-거리다
49030,게걸-대다,동사,상스러운 말로 소리를 지르며 불평스럽게 자꾸 떠들다.,비슷한말 게걸-거리다
49033,게걸-들다,동사,몹시 먹고 싶거나 하고 싶은 욕심에 사로잡히다.,비슷한말 게걸-들리다
49034,게걸-들리다,동사,몹시 먹고 싶거나 하고 싶은 욕심에 사로잡히다.,비슷한말 게걸-들다
