,어휘,품사,뜻풀이,관련 어휘
27460,귀얄질-하다,동사,토기 표면을 고르기 위하여 얕고 거칠게 긁다.,
27466,귀양-내다,동사,"제주도에서, 사람이 죽었을 때 저승으로 잘 가도록 굿을 하다.",비슷한말 귀양풀이-하다
27470,귀양살이-하다,동사,귀양의 형벌을 받고 정해진 곳에서 부자유스럽게 지내다.,
27480,귀양풀이-하다,동사,"제주도에서, 사람이 죽었을 때 저승으로 잘 가도록 굿을 하다.",비슷한말 귀양-내다
27518,귀엣말-하다,동사,남의 귀 가까이에 입을 대고 소곤거리다.,"비슷한말 귓속말-하다, 이어-하다(耳語하다)"
27522,귀여겨-듣다,동사,정신 차려서 주의 깊게 듣다.,반대말 귀넘어-듣다
27527,귀여워-하다,동사,귀엽게 여기다.,
27740,귀-재다,동사,혹시 잘못 들은 것이 아닌가 하고 귀를 기울이다.,
27781,귀접이-하다,동사,물건의 귀를 깎아 버리거나 접어 붙이다.,
27962,귀찮아-하다,동사,귀찮게 여기다.,
28461,귓속다짐-하다,동사,귀엣말로 다짐하다.,
28463,귓속말-하다,동사,남의 귀 가까이에 입을 대고 소곤거리다.,"비슷한말 귀엣말-하다, 이어-하다(耳語하다)"
28474,귓속질-하다,동사,(낮잡는 뜻으로) 귀엣말로 소곤거리다.,
30164,그느다,동사,젖먹이가 오줌이나 똥을 눌 때를 가리다.,
30167,그느르다,동사,돌보고 보살펴 주다.,
30220,그늘-지다,동사,그늘이 생기다.,
30247,그닐-거리다,동사,벌레가 기어가는 것처럼 살갗에 근지럽고 저릿한 느낌이 자꾸 들다.,"비슷한말 그닐-대다, 그닐그닐-하다
참고 어휘 가닐-거리다"
30251,그닐그닐-하다,동사,벌레가 기어가는 것처럼 살갗이 자꾸 또는 매우 근지럽고 저릿한 느낌이 들다.,비슷한말 그닐-거리다
30253,그닐-대다,동사,벌레가 기어가는 것처럼 살갗에 근지럽고 저릿한 느낌이 자꾸 들다.,비슷한말 그닐-거리다
31018,그러그러다,동사,다 그렇게 하거나 잇따라 그렇게 하다.,"참고 어휘 고러고러다, 요러요러다, 이러이러다, 저러저러다, 조러조러다"
31036,그러-내다,동사,속에 깊이 들어 있는 것을 그러당기어 밖으로 내다.,
31037,그러-넣다,동사,사방에 흩어져 있는 것을 그러모아 안으로 집어넣다.,
31044,그러다,동사,그렇게 말하다.,"참고 어휘 고러다, 요러다, 이러다, 저러다, 조러다"
31047,그러-담다,동사,흩어져 있는 것을 한곳에 모아 담다.,
31048,그러-당기다,동사,흩어진 것을 한데 모아 당기다.,
31050,그러-덮다,동사,한데 모아서 덮다.,
31063,그러-들이다,동사,그러당기어 들이다.,
31070,그러-먹다,동사,한곳에 모아서 먹다.,
31079,그러-모으다,동사,흩어져 있는 사람이나 사물 따위를 거두어 한곳에 모으다.,
31085,그러-묻다,동사,흩어져 있는 것을 거두어 한곳에 모아 묻다.,
31092,그러-안다,동사,두 팔로 싸잡아 껴안다.,
31098,그러-잡다,동사,자신이 있는 쪽으로 당겨 붙잡다.,
31101,그러저러다,동사,그렇게 하기도 하고 저렇게 하기도 하다.,"참고 어휘 고러조러다, 요러조러다, 이러저러다"
31103,그러-쥐다,동사,그러당겨 손안에 잡다.,
31118,그럭저럭-하다,동사,특별할 것 없이 그렇게 저렇게 하다.,비슷한말 그렁저렁-하다
31185,그렁성저렁성-하다,동사,그런 모양 저런 모양으로 아무런 대중이 없이 하다.,
31190,그렁저렁-하다,동사,특별할 것 없이 그렇게 저렇게 하다.,비슷한말 그럭저럭-하다
31403,그레질-하다,동사,기둥이나 재목 따위에 그레로 그 놓일 자리의 바닥의 높낮이를 그리다.,
31523,그루갈이-하다,동사,"벼, 보리 따위를 수확하고 다시 농사를 짓기 위하여 그 자리를 갈고 김을 매다.",
31532,그루-되다,동사,서너 살 안짝의 아이가 늦되다.,
31551,그루-박다,동사,물건을 들어 바닥에 거꾸로 탁 놓다.,
31722,그르다,동사,어떤 일이나 형편이 잘못되다.,
31729,그르렁-거리다,동사,목구멍에 가래 따위가 걸려 숨을 쉴 때 거치적거리는 소리가 자꾸 나다.,"준말 그렁-거리다
비슷한말 그르렁-대다, 그르렁그르렁-하다
참고 어휘 가르랑-거리다"
31731,그르렁그르렁-하다,동사,목구멍에 가래 따위가 걸려 숨을 쉴 때 자꾸 거치적거리는 소리가 나다.,"준말 그렁그렁-하다
비슷한말 그르렁-거리다, 그르렁-대다
참고 어휘 가르랑가르랑-하다"
31732,그르렁-대다,동사,목구멍에 가래 따위가 걸려 숨을 쉴 때 거치적거리는 소리가 자꾸 나다.,"준말 그렁-대다
비슷한말 그르렁-거리다, 그르렁그르렁-하다
참고 어휘 가르랑-대다"
31741,그르치다,동사,잘못하여 일을 그릇되게 하다.,
31784,그릇-되다,동사,어떤 일이 사리에 맞지 아니하다.,
31799,그릇-하다,동사,어떤 일을 사리에 맞지 아니하게 하다.,
31840,그리다,동사,사랑하는 마음으로 간절히 생각하다.,
31851,그리-되다,동사,"상태, 모양, 성질 따위가 그러하게 되다.",
32038,그리워-지다,동사,그리운 마음이 생기다.,
32039,그리워-하다,동사,사랑하여 몹시 보고 싶어 하다.,
32046,그리저리-하다,동사,말이나 행동을 뚜렷하게 정함이 없이 그러하고 저러하게 되는대로 하다.,
32084,그리-하다,동사,그렇게 하다.,"준말 그러다
참고 어휘 고리-하다, 이리-하다, 저리-하다"
32471,그림풀이-하다,동사,글의 내용을 그림으로 풀이하다.,비슷한말 도해-하다(圖解하다)
32519,그만-두다,동사,하던 일을 그치고 안 하다.,"준말 간-두다
참고 어휘 고만-두다"
32538,그만-하다,동사,하던 일을 그만 멈추다.,
32562,그무러-지다,동사,구름이 껴 날이 흐리고 어둠침침하게 되다.,참고 어휘 끄무러-지다
32583,그물-거리다,동사,날씨가 활짝 개지 아니하고 자꾸 흐려지다.,"비슷한말 그물-대다, 그물그물-하다
참고 어휘 끄물-거리다"
32597,그물그물-하다,동사,날씨가 활짝 개지 않고 몹시 흐려지다.,비슷한말 그물-거리다
32615,그물-대다,동사,날씨가 활짝 개지 아니하고 자꾸 흐려지다.,비슷한말 그물-거리다
32625,그물뜨기-하다,동사,그물을 뜨다.,비슷한말 편망-하다(編網하다)
32753,그물질-하다,동사,좽이나 반두 따위의 그물로 고기를 잡다.,
32835,그믐치-하다,동사,음력 그믐께에 비나 눈이 내리다.,
32882,그슬다,동사,불에 겉만 약간 타게 하다.,
32947,그어-주다,동사,돈이나 곡식 가운데서 얼마를 몫으로 떼어 주다.,준말 거-주다
32993,그을다,동사,"햇볕이나 불, 연기 따위를 오래 쬐어 검게 되다.",준말 글다
33180,그치다,동사,계속되던 일이나 움직임이 멈추거나 끝나다. 또는 그렇게 하다.,
34150,극젱이질-하다,동사,극젱이로 고랑을 파서 이랑의 북을 돋우다.,
34329,극터듬다,동사,간신히 붙잡고 기어오르다.,
34794,근대다,동사,몹시 성가시게 하다.,
34871,근덕-거리다,동사,큰 물체가 가로로 조금씩 자꾸 흔들리다. 또는 그렇게 되게 하다.,"비슷한말 근덕-대다, 근덕근덕-하다
참고 어휘 간닥-거리다, 끈덕-거리다, 끈떡-거리다"
34873,근덕근덕-하다,동사,큰 물체가 가로로 자꾸 조금씩 흔들리다. 또는 그렇게 되게 하다.,비슷한말 근덕-거리다
34874,근덕-대다,동사,큰 물체가 가로로 조금씩 자꾸 흔들리다. 또는 그렇게 되게 하다.,비슷한말 근덕-거리다
34876,근덕-이다,동사,큰 물체가 가로로 조금씩 흔들리다. 또는 그렇게 되게 하다.,
34887,근뎅-거리다,동사,느슨하게 달려 있는 물체가 조금 위태롭게 자꾸 흔들리다.,"비슷한말 근뎅-대다, 근뎅근뎅-하다
참고 어휘 간댕-거리다"
34889,근뎅근뎅-하다,동사,느슨하게 달려 있는 물체가 자꾸 조금 위태롭게 흔들리다.,비슷한말 근뎅-거리다
34890,근뎅-대다,동사,느슨하게 달려 있는 물체가 조금 위태롭게 자꾸 흔들리다.,비슷한말 근뎅-거리다
34891,근뎅-이다,동사,느슨하게 달려 있는 물체가 조금 위태롭게 흔들리다.,
34923,근드렁-거리다,동사,큰 물체가 매달려 조금 거볍고 느리게 큰 진폭으로 자꾸 흔들리다.,"비슷한말 근드렁-대다, 근드렁근드렁-하다
참고 어휘 간드랑-거리다"
34925,근드렁근드렁-하다,동사,큰 물체가 매달려 조금 거볍고 느리게 자꾸 큰 진폭으로 흔들리다.,비슷한말 근드렁-거리다
34926,근드렁-대다,동사,큰 물체가 매달려 조금 거볍고 느리게 큰 진폭으로 자꾸 흔들리다.,비슷한말 근드렁-거리다
34928,근드렁-하다,동사,큰 물체가 매달려 거볍고 느리게 큰 진폭으로 흔들리다.,
34930,근드적-거리다,동사,무엇에 기대어 있거나 붙어 있는 큰 물체가 천천히 거볍게 자꾸 흔들리다.,"비슷한말 근드적-대다, 근드적근드적-하다
참고 어휘 간드작-거리다"
34932,근드적근드적-하다,동사,무엇에 기대어 있거나 붙어 있는 큰 물체가 자꾸 천천히 거볍게 흔들리다.,비슷한말 근드적-거리다
34933,근드적-대다,동사,무엇에 기대어 있거나 붙어 있는 큰 물체가 천천히 거볍게 자꾸 흔들리다.,비슷한말 근드적-거리다
34936,근들-거리다,동사,물체가 이리저리 조금 가볍게 자꾸 흔들리다. 또는 그렇게 되게 하다.,"비슷한말 근들-대다, 근들근들-하다
참고 어휘 간들-거리다, 건들-거리다"
34938,근들근들-하다,동사,물체가 이리저리 자꾸 조금 가볍게 흔들리다. 또는 그렇게 흔들다.,비슷한말 근들-거리다
34940,근들-대다,동사,물체가 이리저리 조금 가볍게 자꾸 흔들리다. 또는 그렇게 되게 하다.,비슷한말 근들-거리다
35498,근실-거리다,동사,조금 가려운 느낌이 자꾸 들다.,"비슷한말 근실-대다, 근실근실-하다"
35500,근실근실-하다,동사,잇따라 조금 가려운 느낌이 들다.,비슷한말 근실-거리다
35501,근실-대다,동사,조금 가려운 느낌이 자꾸 들다.,비슷한말 근실-거리다
35518,근심-되다,동사,해결되지 않은 일 때문에 속이 타거나 우울해지다.,"비슷한말 걱정-되다, 염려-되다(念慮되다)"
35530,근심-하다,동사,해결되지 않은 일 때문에 속을 태우거나 우울해하다.,"비슷한말 걱정-하다, 염려-하다(念慮하다)"
36189,근질-거리다,동사,근지러운 느낌이 자꾸 들다.,"비슷한말 근질-대다, 근질근질-하다
참고 어휘 간질-거리다"
36193,근질근질-하다,동사,자꾸 근지러운 느낌이 들다.,"비슷한말 근질-거리다, 근질-대다
참고 어휘 간질간질-하다"
36199,근질-대다,동사,근지러운 느낌이 자꾸 들다.,"비슷한말 근질-거리다, 근질근질-하다
참고 어휘 간질-대다"
36201,근질-이다,동사,살갗을 문지르거나 건드려 근지럽게 하다.,
36469,글겅-이다,동사,가래 따위가 목구멍에 걸려 숨 쉴 때마다 거친 소리가 나다.,
36473,글겅이질-하다,동사,글겅이로 말이나 소 따위의 털을 빗기다.,
36508,글그렁-거리다,동사,가래 따위가 목구멍에 걸려 숨 쉴 때마다 거친 소리가 자꾸 나다.,"준말 글겅-거리다
비슷한말 글그렁-대다, 글그렁글그렁-하다
참고 어휘 갈그랑-거리다"
36510,글그렁글그렁-하다,동사,가래 따위가 목구멍에 걸려 숨 쉴 때마다 자꾸 거친 소리가 나다.,"준말 글겅글겅-하다
비슷한말 글그렁-거리다, 글그렁-대다
참고 어휘 갈그랑갈그랑-하다"
36511,글그렁-대다,동사,가래 따위가 목구멍에 걸려 숨 쉴 때마다 거친 소리가 자꾸 나다.,"준말 글겅-대다
비슷한말 글그렁-거리다, 글그렁글그렁-하다
참고 어휘 갈그랑-대다"
36555,글-뛰다,동사,동경하는 마음이 뒤끓다.,
37230,글썽-거리다,동사,눈에 눈물이 자꾸 넘칠 듯이 그득하게 고이다. 또는 그렇게 하다.,"비슷한말 글썽-대다, 글썽글썽-하다"
37232,글썽글썽-하다,동사,눈에 눈물이 넘칠 듯이 자꾸 그득하게 고이다. 또는 그렇게 하다.,"비슷한말 글썽-거리다, 글썽-대다"
37234,글썽-대다,동사,눈에 눈물이 자꾸 넘칠 듯이 그득하게 고이다. 또는 그렇게 하다.,"비슷한말 글썽-거리다, 글썽글썽-하다"
37235,글썽-이다,동사,눈에 눈물이 넘칠 듯이 그득하게 고이다. 또는 그렇게 하다.,
37236,글썽-하다,동사,눈에 눈물이 넘칠 듯이 그득하게 고이다.,
37348,글짓기-하다,동사,글을 짓다.,"비슷한말 글-하다, 작문-하다(作文하다), 찬문-하다(撰文하다), 철문-하다(綴文하다), 행문-하다(行文하다)"
37366,글치레-하다,동사,글을 잘 매만져 꾸미다.,
37371,글컹-거리다,동사,남의 심사를 자꾸 긁어 상하게 하다.,"비슷한말 글컹-대다, 글컹글컹-하다"
37373,글컹글컹-하다,동사,남의 심사를 자꾸 긁어 몹시 상하게 하다.,비슷한말 글컹-거리다
37374,글컹-대다,동사,남의 심사를 자꾸 긁어 상하게 하다.,비슷한말 글컹-거리다
37404,글-하다,동사,글을 짓다.,비슷한말 글짓기-하다
37430,긁다,동사,손톱이나 뾰족한 기구 따위로 바닥이나 거죽을 문지르다.,"비슷한말 긁적-이다, 긁적긁적-하다
참고 어휘 갉다"
37446,긁어-내다,동사,안에 있는 것을 긁어서 꺼내다.,
37448,긁어-내리다,동사,높은 곳에 있는 것을 긁어서 내려보내다.,
37452,긁어-놓다,동사,긁어서 모아 놓다.,
37453,긁어-당기다,동사,긁어서 앞으로 끌다.,참고 어휘 갉아-당기다
37454,긁어-먹다,동사,남의 재물을 교활하고 악독한 방법으로 빼앗아 가지다.,참고 어휘 갉아-먹다
37461,긁어-모으다,동사,물건을 긁어서 한데 모으다.,
37471,긁어-쥐다,동사,잘 잡히지 않는 물건을 손톱으로 긁는 것처럼 움켜쥐다.,
37484,긁적-거리다,동사,손톱이나 뾰족한 기구 따위로 바닥이나 거죽을 자꾸 문지르다.,"비슷한말 긁적-대다, 긁적긁적-하다
참고 어휘 갉작-거리다"
37489,긁적긁적-하다,동사,손톱이나 뾰족한 기구 따위로 자꾸 바닥이나 거죽을 마구 문지르다.,"비슷한말 긁다, 긁적-거리다, 긁적-대다"
37491,긁적-대다,동사,손톱이나 뾰족한 기구 따위로 바닥이나 거죽을 자꾸 문지르다.,"비슷한말 긁적-거리다, 긁적긁적-하다
참고 어휘 갉작-대다"
37494,긁적-이다,동사,손톱이나 뾰족한 기구 따위로 바닥이나 거죽을 문지르다.,비슷한말 긁다
37497,긁죽-거리다,동사,자꾸 함부로 긁다.,"비슷한말 긁죽-대다, 긁죽긁죽-하다
참고 어휘 갉죽-거리다"
37499,긁죽긁죽-하다,동사,함부로 자꾸 긁다.,비슷한말 긁죽-거리다
37500,긁죽-대다,동사,자꾸 함부로 긁다.,비슷한말 긁죽-거리다
37501,긁죽-이다,동사,함부로 긁다.,
38092,금-나다,동사,물건값이 정해져서 팔고 살 수 있게 되다.,비슷한말 값-나다
38540,금-매다,동사,값을 정하다.,
39524,금실-거리다,동사,느리고 폭이 넓게 자꾸 물결치다.,"비슷한말 금실-대다, 금실금실-하다"
39526,금실금실-하다,동사,느리고 폭이 넓게 자꾸 몹시 물결치다.,비슷한말 금실-거리다
39527,금실-대다,동사,느리고 폭이 넓게 자꾸 물결치다.,비슷한말 금실-거리다
40685,금-파오다,동사,"음력 정월 열나흗날 저녁에, 서울 종로 거리에서 낮에 칼이나 패물을 팔던 가게 자리의 흙을 파 오다. 그 흙을 조왕(竈王)에게 바치면 부자가 된다고 한다.",
40751,금-하다,동사,흥정하여 값을 정하다.,
42276,긋다,동사,어떤 일정한 부분을 강조하거나 나타내기 위하여 금이나 줄을 그리다.,
44333,기꺼워-하다,동사,기껍게 여기다.,비슷한말 기꺼-하다
44335,기꺼-하다,동사,기껍게 여기다.,비슷한말 기꺼워-하다
44982,기다,동사,가슴과 배를 바닥으로 향하고 손이나 팔다리 따위를 놀려 앞으로 나아가다.,
44998,기다래-지다,동사,기다랗게 되다.,
45001,기다리다,동사,어떤 사람이나 때가 오기를 바라다.,
45088,기대다,동사,몸이나 물건을 무엇에 의지하면서 비스듬히 대다.,
45101,기대-서다,동사,벽 따위에 손을 짚거나 팔을 붙여 몸을 의지하여 비스듬히 서다.,
45120,기대-앉다,동사,벽 따위에 몸을 의지하여 비스듬히 앉다.,
45548,기둥-팔리다,동사,(은어로) ‘절름거리다’를 이르는 말.,비슷한말 절름-거리다
46023,기르다,동사,동식물을 보살펴 자라게 하다.,비슷한말 키우다
46065,기름걸레질-하다,동사,기계나 기구 따위를 기름으로 닦다.,
46295,기름튀기-하다,동사,"채소, 생선, 고기 따위를 썰거나 저민 다음 밀가루 반죽에 묻혀 끓는 기름에 튀겨 내다.",
46341,기리다,동사,"뛰어난 업적이나 바람직한 정신, 위대한 사람 따위를 칭찬하고 기억하다.",
47814,기뻐-하다,동사,마음에 기쁨을 느끼다.,반대말 슬퍼-하다
49262,기신-거리다,동사,게으르거나 기운이 없어 자꾸 느릿느릿 힘없이 행동하다.,"비슷한말 기신-대다, 기신기신-하다
참고 어휘 개신-거리다"
49267,기신기신-하다,동사,게으르거나 기운이 없어 느릿느릿 자꾸 힘없이 행동하다.,비슷한말 기신-거리다
49269,기신-대다,동사,게으르거나 기운이 없어 자꾸 느릿느릿 힘없이 행동하다.,비슷한말 기신-거리다
49551,기어-가다,동사,어떤 곳을 기어서 가다.,
49564,기어-들다,동사,기어서 또는 기는 듯한 모습으로 들어가거나 들어오다.,
49585,기어-오르다,동사,기는 듯한 모습으로 높은 곳을 올라가거나 올라오다.,
49912,기엄기엄-하다,동사,자꾸 기어가거나 기는 듯이 움직이다.,
,어휘,품사,뜻풀이,관련 어휘
553,목귀질-하다,동사,목재의 모서리를 둥그스름하게 하기 위하여 나무를 다듬다.,
590,목기침-하다,동사,목청을 가다듬을 때에 하듯이 목을 울려 기침을 하다.,
625,목놀림-하다,동사,어린아이의 목을 축일 만한 정도로 젖을 적게 먹이다.,
645,목다심-하다,동사,물을 조금 마시거나 기침을 하거나 하여 거친 목을 고르다.,
771,목도질-하다,동사,목도를 하다.,비슷한말 목도-하다
775,목도-하다,동사,"두 사람 이상이 짝이 되어, 무거운 물건이나 돌덩이를 얽어맨 밧줄에 몽둥이를 꿰어 어깨에 메고 나르다.",비슷한말 목도질-하다
1016,목-마르다,동사,어떠한 것을 간절히 원하다.,
1047,목말라-하다,동사,목마르게 여기다.,
1071,목-매다,동사,죽거나 죽이려고 끈이나 줄 같은 것으로 높은 곳에 목을 걸어 매다.,비슷한말 목-매달다
1074,목-매달다,동사,죽거나 죽이려고 끈이나 줄 같은 것으로 높은 곳에 목을 걸어 매달다.,비슷한말 목-매다
1088,목-메다,동사,기쁨이나 설움 따위의 감정이 북받쳐 솟아올라 그 기운이 목에 엉기어 막히다.,
1138,목물-하다,동사,상체를 굽혀 엎드린 채로 다른 사람의 도움을 받아 허리에서부터 목까지를 물로 씻다.,비슷한말 등목-하다
1333,목새-돌다,동사,벼가 목새에 걸리다.,
1449,목-쉬다,동사,목이 잠겨 소리가 제대로 나지 아니하다.,
1735,목-잡다,동사,"금광에서 함지질할 때 나오는, 납이나 은, 새 따위가 섞여 있는 가루를 따로 모으다.",
2020,목접이질-하다,동사,목이 접질리도록 굽히는 짓을 하다.,비슷한말 목접질-하다
2021,목접이-하다,동사,목이 접질리어 부러지다.,
2023,목접질-하다,동사,목이 접질리도록 굽히는 짓을 하다.,비슷한말 목접이질-하다
2767,몬닥몬닥-하다,동사,작은 덩이로 자꾸 똑똑 끊어지거나 잘라지다.,
2768,몬닥-하다,동사,작은 덩이로 똑 끊어지거나 잘라지다.,
3161,몰다,동사,어떤 대상을 바라는 처지나 방향으로 움직여 가게 하다.,
3220,몰라-보다,동사,알 만한 사실이나 사물을 보고도 알아차리지 못하다.,
3223,몰라-뵈다,동사,"나이나 지위, 신분, 항렬 따위가 자기보다 높은 사람을 알아차리지 못하다.",
3224,몰라-뵙다,동사,"나이나 지위, 신분, 항렬 따위가 자기보다 높은 사람을 알아차리지 못하다. ‘몰라뵈다’보다 더 겸양의 뜻을 나타낸다.",
3225,몰라-주다,동사,알아주지 아니하다.,반대말 알아-주다
3243,몰랑-거리다,동사,매우 또는 여기저기가 야들야들하게 보드랍고 조금 무른 듯한 느낌이 들다.,"비슷한말 몰랑-대다, 몰랑-하다
참고 어휘 말랑-거리다, 물렁-거리다"
3244,몰랑-대다,동사,매우 또는 여기저기가 야들야들하게 보드랍고 조금 무른 듯한 느낌이 들다.,비슷한말 몰랑-거리다
3294,몰려-가다,동사,여럿이 떼를 지어 한쪽으로 가다.,
3296,몰려-나다,동사,있던 자리에서 쫓겨 나가다.,
3297,몰려-나오다,동사,여럿이 떼를 지어 나오다.,
3298,몰려-다니다,동사,여럿이 떼를 지어 돌아다니다.,
3299,몰려-들다,동사,여럿이 떼를 지어 들어오다.,
3303,몰려-서다,동사,여럿이 떼를 지어 한군데에 모여 서다.,
3304,몰려-오다,동사,여럿이 떼를 지어 한쪽으로 밀려오다.,
3338,몰-리다,동사,여럿이 한곳으로 모여들다.,
3405,몰매질-하다,동사,사정없이 몰아쳐서 매질을 하다.,"비슷한말 난장질-하다(亂杖질하다), 무릿매질-하다"
3420,몰-밀다,동사,모두 한곳으로 밀다.,
3424,몰-박다,동사,한곳에 촘촘히 몰아서 박다.,
3542,몰씬-거리다,동사,잘 익거나 물러서 매우 또는 여기저기가 연하고 몰랑한 느낌이 들다.,비슷한말 몰씬-대다
3543,몰씬-대다,동사,잘 익거나 물러서 매우 또는 여기저기가 연하고 몰랑한 느낌이 들다.,비슷한말 몰씬-거리다
3552,몰아-가다,동사,몰아서 일정한 방향으로 이끌다.,
3554,몰아-내다,동사,몰아서 밖으로 쫓거나 나가게 하다.,
3556,몰아-넣다,동사,몰아서 안으로 들어가게 하다.,
3558,몰아-닥치다,동사,한꺼번에 세게 들이닥치다.,
3559,몰아-대다,동사,옴짝달싹 못 하도록 마구 해 대거나 한쪽으로 내몰다.,
3560,몰아-들다,동사,한꺼번에 밀리어 들다.,
3561,몰아-들이다,동사,몰아서 억지로 들어오게 하다.,
3565,몰아-붙이다,동사,한쪽 방향으로 몰려가게 하다.,
3571,몰아-세우다,동사,잘잘못을 가리지도 않고 마구 다그치거나 나무라다.,준말 몰아-세다
3574,몰아-쉬다,동사,숨 따위를 한꺼번에 모아 쉬다.,
3577,몰아-오다,동사,한곳으로 몰려서 한꺼번에 오다.,
3582,몰아-주다,동사,여러 번에 나누어 줄 것을 한꺼번에 주다.,
3587,몰아-치다,동사,한꺼번에 몰려 닥치다.,
3756,몰캉-거리다,동사,너무 익거나 곯아서 물크러질 정도로 매우 또는 여기저기가 몰랑한 느낌이 들다.,"비슷한말 몰캉-대다, 몰캉-하다
참고 어휘 말캉-거리다, 물컹-거리다"
3757,몰캉-대다,동사,너무 익거나 곯아서 물크러질 정도로 매우 또는 여기저기가 몰랑한 느낌이 들다.,비슷한말 몰캉-거리다
3858,몸가눔-하다,동사,몸의 균형을 바로잡다.,
3863,몸가축-하다,동사,몸을 매만지고 다듬다.,
3895,몸굿-하다,동사,몸에 내린 신을 맞아서 무당이 되려고 신에게 비는 굿을 하다.,"비슷한말 강신굿-하다(降神굿하다), 내림굿-하다"
3909,몸놀림-하다,동사,몸을 움직이다.,
3923,몸닦달질-하다,동사,몸닦달을 계속적으로 하다.,
3924,몸닦달-하다,동사,몸을 튼튼하게 단련하기 위하여 견디기 어려운 것을 참아 가며 훈련을 받다.,
3935,몸-담다,동사,어떤 직업이나 분야에 종사하거나 그 일을 하다.,
4011,몸부림-치다,동사,심하게 온몸을 흔들고 부딪다.,
4013,몸부림-하다,동사,있는 힘을 다하거나 감정이 격하여서 온몸을 흔들고 부딪다.,
4036,몸살풀이-하다,동사,몸살이 낫도록 쉬다.,
4041,몸서리-나다,동사,몹시 싫거나 무서워서 몸이 떨리다.,비슷한말 몸서리-치다
4043,몸서리-치다,동사,몹시 싫거나 무서워서 몸이 떨리다.,비슷한말 몸서리-나다
4059,몸수고-하다,동사,몸으로 힘들이고 애쓰다.,
4075,몸싸움-하다,동사,서로 몸을 부딪치며 싸우다.,
4165,몸져-눕다,동사,병이나 고통이 심하여 몸을 가누지 못하고 누워 있다.,
4201,몸짓-하다,동사,몸을 놀리다.,
4220,몸차림-하다,동사,몸을 보기 좋고 맵시 있게 하려고 치장을 하다.,"비슷한말 몸단장-하다(몸丹粧하다), 몸치레-하다, 몸치장-하다(몸治粧하다), 분식-하다(扮飾하다), 용식-하다(容飾하다)"
